{
  "member_label": "Member 1",
  "type": "sawn",
  "grade": "A17",
  "seasoned": "seasoned",
  "hard_soft": "softwood",
  "section": "custom",
  "d": 70,
  "b": 35,
  "number_holes": 0,
  "hole_diameter": 10,
  "duration": "seconds",
  "application": 1,
  "house": "house",
  "area": "smaller",
  "load_sharing_direction": "none",
  "ncom": 1,
  "nmem": 1,
  "s": 300,
  "restraint_type": "discrete",
  "restraint_side": "compression",
  "L": 1000,
  "Laz": 100,
  "Lay": 100,
  "g13": 0.9,
  "EMC": 15,
  "k6": 1,
  "Mz": 0,
  "My": 0,
  "Vy": 0,
  "Vz": 0,
  "P": 0,
  "uid": "4005-as1720-wood-beam-calculator",
  "current_unit_system": "metric",
  "project_details": {
    "project_company": "",
    "project_name": "",
    "project_designer": "",
    "project_id": "",
    "project_client": "",
    "project_notes": ""
  }
}